{
  "schema": 1,
  "slug": "parce-mihi-domine-morales",
  "linea": "coro",
  "rank": "090",
  "ranks": [
    "090"
  ],
  "titolo": "Parce mihi Domine",
  "compositore": {
    "id": "cristobal-de-morales",
    "nome": "Cristóbal de Morales",
    "breve": "Morales",
    "date": "c. 1500–1553",
    "nascita": "c. 1500",
    "morte": 1553,
    "periodo": "rinascimento",
    "alias": [
      "Cristobal de Morales",
      "Morales"
    ]
  },
  "generi": [
    "sacro"
  ],
  "lingua": "la",
  "organico": "SATB",
  "tempo_bpm": 112,
  "fonte_spartito": "PDMX / MuseScore",
  "licenza_spartito": "PD",
  "voci": [
    {
      "voce": "S",
      "video_id": "RePVgFUZX_g",
      "pubblica_dal": "2026-12-25T15:30:00Z",
      "capitoli": [
        {
          "sec": 0,
          "titolo": "Intro"
        },
        {
          "sec": 12,
          "titolo": "FIRST LISTEN — the whole piece, all voices"
        },
        {
          "sec": 300,
          "titolo": "RHYTHM READING — the words in rhythm, on one note"
        },
        {
          "sec": 589,
          "titolo": "SLOW — your part only"
        },
        {
          "sec": 998,
          "titolo": "FULL TEMPO — your part only"
        },
        {
          "sec": 1286,
          "titolo": "IN PAIRS — your part and Alto"
        },
        {
          "sec": 1574,
          "titolo": "WITH THE CHOIR — your part highlighted"
        },
        {
          "sec": 1861,
          "titolo": "BALANCE CHECK — all voices equal"
        },
        {
          "sec": 2149,
          "titolo": "End screen"
        }
      ],
      "durata_sec": 2169
    },
    {
      "voce": "A",
      "video_id": "u_V2Pwv-1zo",
      "pubblica_dal": "2026-12-25T15:30:00Z",
      "capitoli": [
        {
          "sec": 0,
          "titolo": "Intro"
        },
        {
          "sec": 12,
          "titolo": "FIRST LISTEN — the whole piece, all voices"
        },
        {
          "sec": 300,
          "titolo": "RHYTHM READING — the words in rhythm, on one note"
        },
        {
          "sec": 589,
          "titolo": "SLOW — your part only"
        },
        {
          "sec": 998,
          "titolo": "FULL TEMPO — your part only"
        },
        {
          "sec": 1286,
          "titolo": "IN PAIRS — your part and Soprano"
        },
        {
          "sec": 1574,
          "titolo": "WITH THE CHOIR — your part highlighted"
        },
        {
          "sec": 1861,
          "titolo": "BALANCE CHECK — all voices equal"
        },
        {
          "sec": 2149,
          "titolo": "End screen"
        }
      ],
      "durata_sec": 2169
    },
    {
      "voce": "T",
      "video_id": "q9sb3Ky_eIo",
      "pubblica_dal": "2026-12-25T15:30:00Z",
      "capitoli": [
        {
          "sec": 0,
          "titolo": "Intro"
        },
        {
          "sec": 12,
          "titolo": "FIRST LISTEN — the whole piece, all voices"
        },
        {
          "sec": 300,
          "titolo": "RHYTHM READING — the words in rhythm, on one note"
        },
        {
          "sec": 589,
          "titolo": "SLOW — your part only"
        },
        {
          "sec": 998,
          "titolo": "FULL TEMPO — your part only"
        },
        {
          "sec": 1286,
          "titolo": "IN PAIRS — your part and Basso"
        },
        {
          "sec": 1574,
          "titolo": "WITH THE CHOIR — your part highlighted"
        },
        {
          "sec": 1861,
          "titolo": "BALANCE CHECK — all voices equal"
        },
        {
          "sec": 2149,
          "titolo": "End screen"
        }
      ],
      "durata_sec": 2169
    },
    {
      "voce": "B",
      "video_id": "X9jmQX_e6rY",
      "pubblica_dal": "2026-12-25T15:30:00Z",
      "capitoli": [
        {
          "sec": 0,
          "titolo": "Intro"
        },
        {
          "sec": 12,
          "titolo": "FIRST LISTEN — the whole piece, all voices"
        },
        {
          "sec": 300,
          "titolo": "RHYTHM READING — the words in rhythm, on one note"
        },
        {
          "sec": 589,
          "titolo": "SLOW — your part only"
        },
        {
          "sec": 998,
          "titolo": "FULL TEMPO — your part only"
        },
        {
          "sec": 1286,
          "titolo": "IN PAIRS — your part and Tenore"
        },
        {
          "sec": 1574,
          "titolo": "WITH THE CHOIR — your part highlighted"
        },
        {
          "sec": 1861,
          "titolo": "BALANCE CHECK — all voices equal"
        },
        {
          "sec": 2149,
          "titolo": "End screen"
        }
      ],
      "durata_sec": 2169
    }
  ],
  "prima_uscita": "2026-12-25T15:30:00Z"
}
