{
  "schema": 1,
  "slug": "in-s-angelum-custodem-wab-18-bruckner",
  "linea": "coro",
  "rank": "347",
  "ranks": [
    "347"
  ],
  "titolo": "In S. Angelum custodem WAB 18",
  "compositore": {
    "id": "anton-bruckner",
    "nome": "Anton Bruckner",
    "breve": "Bruckner",
    "date": "1824–1896",
    "nascita": "1824",
    "morte": 1896,
    "periodo": "romantico",
    "alias": [
      "Joseph Anton Bruckner",
      "Bruckner"
    ]
  },
  "generi": [
    "sacro"
  ],
  "lingua": "la",
  "organico": "SATB",
  "tonalita": {
    "tonica": "E",
    "modo": "minor"
  },
  "tempo_bpm": 106,
  "fonte_spartito": "PDMX / MuseScore",
  "licenza_spartito": "PD",
  "voci": [
    {
      "voce": "S",
      "video_id": "OwSucJGSVMw",
      "pubblica_dal": "2026-11-18T15:30:00Z",
      "capitoli": [
        {
          "sec": 0,
          "titolo": "Intro"
        },
        {
          "sec": 12,
          "titolo": "FIRST LISTEN — the whole piece, all voices"
        },
        {
          "sec": 75,
          "titolo": "RHYTHM READING — the words in rhythm, on one note"
        },
        {
          "sec": 141,
          "titolo": "SLOW — your part only"
        },
        {
          "sec": 230,
          "titolo": "FULL TEMPO — your part only"
        },
        {
          "sec": 293,
          "titolo": "IN PAIRS — your part and Alto"
        },
        {
          "sec": 357,
          "titolo": "WITH THE CHOIR — your part highlighted"
        },
        {
          "sec": 420,
          "titolo": "BALANCE CHECK — all voices equal"
        },
        {
          "sec": 483,
          "titolo": "End screen"
        }
      ],
      "durata_sec": 503
    },
    {
      "voce": "A",
      "video_id": "f4rgipcy8OY",
      "pubblica_dal": "2026-11-18T15:30:00Z",
      "capitoli": [
        {
          "sec": 0,
          "titolo": "Intro"
        },
        {
          "sec": 12,
          "titolo": "FIRST LISTEN — the whole piece, all voices"
        },
        {
          "sec": 75,
          "titolo": "RHYTHM READING — the words in rhythm, on one note"
        },
        {
          "sec": 141,
          "titolo": "SLOW — your part only"
        },
        {
          "sec": 230,
          "titolo": "FULL TEMPO — your part only"
        },
        {
          "sec": 293,
          "titolo": "IN PAIRS — your part and Soprano"
        },
        {
          "sec": 357,
          "titolo": "WITH THE CHOIR — your part highlighted"
        },
        {
          "sec": 420,
          "titolo": "BALANCE CHECK — all voices equal"
        },
        {
          "sec": 483,
          "titolo": "End screen"
        }
      ],
      "durata_sec": 503
    },
    {
      "voce": "T",
      "video_id": "qehfqoBGXyc",
      "pubblica_dal": "2026-11-18T15:30:00Z",
      "capitoli": [
        {
          "sec": 0,
          "titolo": "Intro"
        },
        {
          "sec": 12,
          "titolo": "FIRST LISTEN — the whole piece, all voices"
        },
        {
          "sec": 75,
          "titolo": "RHYTHM READING — the words in rhythm, on one note"
        },
        {
          "sec": 141,
          "titolo": "SLOW — your part only"
        },
        {
          "sec": 230,
          "titolo": "FULL TEMPO — your part only"
        },
        {
          "sec": 293,
          "titolo": "IN PAIRS — your part and Basso"
        },
        {
          "sec": 357,
          "titolo": "WITH THE CHOIR — your part highlighted"
        },
        {
          "sec": 420,
          "titolo": "BALANCE CHECK — all voices equal"
        },
        {
          "sec": 483,
          "titolo": "End screen"
        }
      ],
      "durata_sec": 503
    },
    {
      "voce": "B",
      "video_id": "GBJ_os27uZY",
      "pubblica_dal": "2026-11-18T15:30:00Z",
      "capitoli": [
        {
          "sec": 0,
          "titolo": "Intro"
        },
        {
          "sec": 12,
          "titolo": "FIRST LISTEN — the whole piece, all voices"
        },
        {
          "sec": 75,
          "titolo": "RHYTHM READING — the words in rhythm, on one note"
        },
        {
          "sec": 141,
          "titolo": "SLOW — your part only"
        },
        {
          "sec": 230,
          "titolo": "FULL TEMPO — your part only"
        },
        {
          "sec": 293,
          "titolo": "IN PAIRS — your part and Tenore"
        },
        {
          "sec": 357,
          "titolo": "WITH THE CHOIR — your part highlighted"
        },
        {
          "sec": 420,
          "titolo": "BALANCE CHECK — all voices equal"
        },
        {
          "sec": 483,
          "titolo": "End screen"
        }
      ],
      "durata_sec": 503
    }
  ],
  "prima_uscita": "2026-11-18T15:30:00Z"
}
