{
  "schema": 1,
  "slug": "ave-maria-josquin",
  "linea": "coro",
  "rank": "093",
  "ranks": [
    "093"
  ],
  "titolo": "Ave Maria",
  "compositore": {
    "id": "josquin-des-prez",
    "nome": "Josquin des Prez",
    "breve": "Josquin",
    "date": "c. 1450–1521",
    "nascita": "c. 1450",
    "morte": 1521,
    "periodo": "rinascimento",
    "varianti": [
      "Josquin Desprez",
      "Josquin"
    ],
    "alias": [
      "Josquin des Prés",
      "Josquin Desprez",
      "Josquin desPrez",
      "Josquin Des Pres",
      "Josquin",
      "des Prez"
    ]
  },
  "stagioni": [
    "mariano"
  ],
  "generi": [
    "sacro"
  ],
  "lingua": "la",
  "organico": "SATB",
  "tempo_bpm": [
    130,
    195
  ],
  "fonte_spartito": "PDMX / MuseScore",
  "licenza_spartito": "PD",
  "voci": [
    {
      "voce": "S",
      "video_id": "ZBmO2C93m0Y",
      "pubblica_dal": "2026-12-28T15:30:00Z",
      "capitoli": [
        {
          "sec": 0,
          "titolo": "Intro"
        },
        {
          "sec": 12,
          "titolo": "FIRST LISTEN — the whole piece, all voices"
        },
        {
          "sec": 290,
          "titolo": "RHYTHM READING — the words in rhythm, on one note"
        },
        {
          "sec": 570,
          "titolo": "SLOW — your part only"
        },
        {
          "sec": 966,
          "titolo": "FULL TEMPO — your part only"
        },
        {
          "sec": 1244,
          "titolo": "IN PAIRS — your part and Alto"
        },
        {
          "sec": 1522,
          "titolo": "WITH THE CHOIR — your part highlighted"
        },
        {
          "sec": 1800,
          "titolo": "BALANCE CHECK — all voices equal"
        },
        {
          "sec": 2078,
          "titolo": "End screen"
        }
      ],
      "durata_sec": 2098
    },
    {
      "voce": "A",
      "video_id": "dbKaNlrzH_o",
      "pubblica_dal": "2026-12-28T15:30:00Z",
      "capitoli": [
        {
          "sec": 0,
          "titolo": "Intro"
        },
        {
          "sec": 12,
          "titolo": "FIRST LISTEN — the whole piece, all voices"
        },
        {
          "sec": 290,
          "titolo": "RHYTHM READING — the words in rhythm, on one note"
        },
        {
          "sec": 568,
          "titolo": "SLOW — your part only"
        },
        {
          "sec": 964,
          "titolo": "FULL TEMPO — your part only"
        },
        {
          "sec": 1242,
          "titolo": "IN PAIRS — your part and Soprano"
        },
        {
          "sec": 1520,
          "titolo": "WITH THE CHOIR — your part highlighted"
        },
        {
          "sec": 1798,
          "titolo": "BALANCE CHECK — all voices equal"
        },
        {
          "sec": 2076,
          "titolo": "End screen"
        }
      ],
      "durata_sec": 2096
    },
    {
      "voce": "T",
      "video_id": "axDwf7rKNGo",
      "pubblica_dal": "2026-12-28T15:30:00Z",
      "capitoli": [
        {
          "sec": 0,
          "titolo": "Intro"
        },
        {
          "sec": 12,
          "titolo": "FIRST LISTEN — the whole piece, all voices"
        },
        {
          "sec": 290,
          "titolo": "RHYTHM READING — the words in rhythm, on one note"
        },
        {
          "sec": 568,
          "titolo": "SLOW — your part only"
        },
        {
          "sec": 964,
          "titolo": "FULL TEMPO — your part only"
        },
        {
          "sec": 1242,
          "titolo": "IN PAIRS — your part and Basso"
        },
        {
          "sec": 1520,
          "titolo": "WITH THE CHOIR — your part highlighted"
        },
        {
          "sec": 1798,
          "titolo": "BALANCE CHECK — all voices equal"
        },
        {
          "sec": 2076,
          "titolo": "End screen"
        }
      ],
      "durata_sec": 2096
    },
    {
      "voce": "B",
      "video_id": "9rfOimiicC0",
      "pubblica_dal": "2026-12-28T15:30:00Z",
      "capitoli": [
        {
          "sec": 0,
          "titolo": "Intro"
        },
        {
          "sec": 12,
          "titolo": "FIRST LISTEN — the whole piece, all voices"
        },
        {
          "sec": 290,
          "titolo": "RHYTHM READING — the words in rhythm, on one note"
        },
        {
          "sec": 568,
          "titolo": "SLOW — your part only"
        },
        {
          "sec": 964,
          "titolo": "FULL TEMPO — your part only"
        },
        {
          "sec": 1242,
          "titolo": "IN PAIRS — your part and Tenore"
        },
        {
          "sec": 1520,
          "titolo": "WITH THE CHOIR — your part highlighted"
        },
        {
          "sec": 1798,
          "titolo": "BALANCE CHECK — all voices equal"
        },
        {
          "sec": 2076,
          "titolo": "End screen"
        }
      ],
      "durata_sec": 2096
    }
  ],
  "prima_uscita": "2026-12-28T15:30:00Z"
}
